topic,authors,title,publicationName,doi,volume,issue,pageRange,coverDate,affiliation,citedbyCount,affilname,affiliation-country,year,month
ECON,Infante G.,A hybrid Krasnosel'skiĭ-Schauder fixed point theorem for systems,Nonlinear Analysis: Real World Applications,10.1016/j.nonrwa.2024.104165,80,,,2024-12-01,"[{'@_fa': 'true', 'affilname': 'Università della Calabria', 'affiliation-city': 'Rende', 'affiliation-country': 'Italy'}]",-0.1234553128007165,Università della Calabria,Italy,2024,12
ECON,Li Y.,Global-in-time error estimates of non-relativistic limits for Euler–Maxwell system near non-constant equilibrium,Nonlinear Analysis: Real World Applications,10.1016/j.nonrwa.2024.104163,80,,,2024-12-01,"[{'@_fa': 'true', 'affilname': 'Shanghai Jiao Tong University', 'affiliation-city': 'Shanghai', 'affiliation-country': 'China'}]",-0.1234553128007165,Shanghai Jiao Tong University,China,2024,12
ECON,Chitpin J.,Languishing: Experiences of emerging adults in outpatient mental health care one year into the COVID-19 pandemic,Humanities and Social Sciences Communications,10.1057/s41599-024-03247-3,11,1,,2024-12-01,"[{'@_fa': 'true', 'affilname': 'Schulich School of Medicine &amp; Dentistry', 'affiliation-city': 'London', 'affiliation-country': 'Canada'}, {'@_fa': 'true', 'affilname': 'London Health Sciences Centre', 'affiliation-city': 'London', 'affiliation-country': 'Canada'}]",-0.1234553128007165,Schulich School of Medicine &amp; Dentistry,Canada,2024,12
ECON,Yang Y.,Local stability and topological structure of completely integrable differential systems,Nonlinear Analysis: Real World Applications,10.1016/j.nonrwa.2024.104172,80,,,2024-12-01,"[{'@_fa': 'true', 'affilname': ""Yan'an University"", 'affiliation-city': ""Xi'an"", 'affiliation-country': 'China'}, {'@_fa': 'true', 'affilname': 'Shanghai Jiao Tong University', 'affiliation-city': 'Shanghai', 'affiliation-country': 'China'}]",-0.1234553128007165,Shanghai Jiao Tong University,China,2024,12
ECON,Muslim N.,From the past to the present: the enduring impact of Hukum Kanun Pahang (Pahang Laws) in Malaysian society,Humanities and Social Sciences Communications,10.1057/s41599-024-03281-1,11,1,,2024-12-01,"[{'@_fa': 'true', 'affilname': 'Universiti Kebangsaan Malaysia', 'affiliation-city': 'Bangi', 'affiliation-country': 'Malaysia'}]",-0.1234553128007165,Universiti Kebangsaan Malaysia,Malaysia,2024,12
ECON,Kaushik R.,Human development and disaster mortality: evidence from India,Humanities and Social Sciences Communications,10.1057/s41599-024-03353-2,11,1,,2024-12-01,"[{'@_fa': 'true', 'affilname': 'FLAME University', 'affiliation-city': 'Pune', 'affiliation-country': 'India'}]",-0.1234553128007165,FLAME University,India,2024,12
ECON,Kang K.P.,Dual verifications in mHealth apps: Supporting self-regulation or increasing friction?,Electronic Markets,10.1007/s12525-024-00716-0,34,1,,2024-12-01,"[{'@_fa': 'true', 'affilname': 'Kyung Hee University', 'affiliation-city': 'Seoul', 'affiliation-country': 'South Korea'}]",-0.1234553128007165,Kyung Hee University,South Korea,2024,12
ECON,Yazew B.T.,Social structure and clan group networks of Afar pastorals along the Lower Awash Valley,Humanities and Social Sciences Communications,10.1057/s41599-024-03344-3,11,1,,2024-12-01,"[{'@_fa': 'true', 'affilname': 'Addis Ababa University', 'affiliation-city': 'Addis Ababa', 'affiliation-country': 'Ethiopia'}]",-0.1234553128007165,Addis Ababa University,Ethiopia,2024,12
ECON,Armitt H.A.,"Reflections and practical tips from co-producing an intervention with neurodiverse children, their families, and professional stakeholders",Humanities and Social Sciences Communications,10.1057/s41599-024-03278-w,11,1,,2024-12-01,"[{'@_fa': 'true', 'affilname': 'Humber Teaching NHS Foundation Trust', 'affiliation-city': 'Willerby', 'affiliation-country': 'United Kingdom'}]",-0.1234553128007165,Humber Teaching NHS Foundation Trust,United Kingdom,2024,12
ECON,Zhang T.,Multiple standing waves of matrix nonlinear Schrödinger equations with mixed growth nonlinearities in R<sup>N</sup>,Nonlinear Analysis: Real World Applications,10.1016/j.nonrwa.2024.104153,80,,,2024-12-01,"[{'@_fa': 'true', 'affilname': 'University of Jinan', 'affiliation-city': 'Jinan', 'affiliation-country': 'China'}]",-0.1234553128007165,University of Jinan,China,2024,12
ECON,Ghadbane H.E.,A New Energy Management Strategy for Electric Vehicles Based on Optimal Adaptive State Machine Control,Smart Grids and Sustainable Energy,10.1007/s40866-024-00208-2,9,2,,2024-12-01,"[{'@_fa': 'true', 'affilname': 'University Guelma', 'affiliation-city': 'Guelma', 'affiliation-country': 'Algeria'}]",-0.1234553128007165,University Guelma,Algeria,2024,12
ECON,Alshammari M.M.,Revolutionizing education: unleashing the power of social media in Saudi Arabian public universities,Humanities and Social Sciences Communications,10.1057/s41599-024-03313-w,11,1,,2024-12-01,"[{'@_fa': 'true', 'affilname': ""University of Ha'il"", 'affiliation-city': 'Hail', 'affiliation-country': 'Saudi Arabia'}]",-0.1234553128007165,,Saudi Arabia,2024,12
ECON,Yang Y.,"Green taxation, regional green development and innovation: Mechanisms of influence and policy optimization",Humanities and Social Sciences Communications,10.1057/s41599-024-03335-4,11,1,,2024-12-01,"[{'@_fa': 'true', 'affilname': 'Guangxi University of Science and Technology', 'affiliation-city': 'Liuzhou', 'affiliation-country': 'China'}, {'@_fa': 'true', 'affilname': 'Research Center for High-Quality Industrial Development of Guangxi', 'affiliation-city': 'Liuzhou', 'affiliation-country': 'China'}]",-0.1234553128007165,Guangxi University of Science and Technology,China,2024,12
ECON,Koebe T.,Unveiling local patterns of child pornography consumption in France using Tor,Humanities and Social Sciences Communications,10.1057/s41599-024-03343-4,11,1,,2024-12-01,"[{'@_fa': 'true', 'affilname': 'Universität des Saarlandes', 'affiliation-city': 'Saarbrucken', 'affiliation-country': 'Germany'}]",-0.1234553128007165,Universität des Saarlandes,Germany,2024,12
ECON,Olipra J.,Does Engel's law work in central and Eastern European countries? The role of aspirations in determining food expenditures,Structural Change and Economic Dynamics,10.1016/j.strueco.2024.06.005,71,,26-34,2024-12-01,"[{'@_fa': 'true', 'affilname': 'Szkola Glówna Handlowa w Warszawie', 'affiliation-city': 'Warsaw', 'affiliation-country': 'Poland'}]",-0.1234553128007165,Szkola Glówna Handlowa w Warszawie,Poland,2024,12
ECON,Poškus M.S.,Testing the simple model of environmental citizenship in a sample of adolescents,Humanities and Social Sciences Communications,10.1057/s41599-024-03297-7,11,1,,2024-12-01,"[{'@_fa': 'true', 'affilname': 'Mykolas Romeris University', 'affiliation-city': 'Vilnius', 'affiliation-country': 'Lithuania'}]",-0.1234553128007165,Mykolas Romeris University,Lithuania,2024,12
ECON,Xiao A.,Bridging the digital divide: the impact of technological innovation on income inequality and human interactions,Humanities and Social Sciences Communications,10.1057/s41599-024-03307-8,11,1,,2024-12-01,"[{'@_fa': 'true', 'affilname': 'Business School of Sichuan University', 'affiliation-city': 'Chengdu', 'affiliation-country': 'China'}]",-0.1234553128007165,Business School of Sichuan University,China,2024,12
ECON,Pilehvar A.A.,Advanced modeling of housing locations in the city of Tehran using machine learning and data mining techniques,Humanities and Social Sciences Communications,10.1057/s41599-024-03244-6,11,1,,2024-12-01,"[{'@_fa': 'true', 'affilname': 'University of Bojnord, Iran', 'affiliation-city': 'Bojnord', 'affiliation-country': 'Iran'}]",-0.1234553128007165,"University of Bojnord, Iran",Iran,2024,12
ECON,Zhang Y.,Centralized use of decentralized technology: Tokenization of currencies and assets,Structural Change and Economic Dynamics,10.1016/j.strueco.2024.06.006,71,,15-25,2024-12-01,"[{'@_fa': 'true', 'affilname': 'University of Surrey', 'affiliation-city': 'Guildford', 'affiliation-country': 'United Kingdom'}]",-0.1234553128007165,University of Surrey,United Kingdom,2024,12
ECON,Khan N.U.,Examining the dynamics of pro-social rule-breaking among grassroots public servants,Humanities and Social Sciences Communications,10.1057/s41599-024-03305-w,11,1,,2024-12-01,"[{'@_fa': 'true', 'affilname': 'Central South University', 'affiliation-city': 'Changsha', 'affiliation-country': 'China'}]",-0.1234553128007165,Central South University,China,2024,12
ECON,Gu H.,Exploring the resilience development of secondary school English teacher-researchers: a Chinese case study,Humanities and Social Sciences Communications,10.1057/s41599-024-03346-1,11,1,,2024-12-01,"[{'@_fa': 'true', 'affilname': 'Soochow University', 'affiliation-city': 'Suzhou', 'affiliation-country': 'China'}]",-0.1234553128007165,Soochow University,China,2024,12
ECON,Cheng L.,Identifying stance in legislative discourse: a corpus-driven study of data protection laws,Humanities and Social Sciences Communications,10.1057/s41599-024-03322-9,11,1,,2024-12-01,"[{'@_fa': 'true', 'affilname': 'Zhejiang University Guanghua Law School', 'affiliation-city': 'Hangzhou', 'affiliation-country': 'China'}]",-0.1234553128007165,Zhejiang University Guanghua Law School,China,2024,12
ECON,Aizenman J.,Geopolitical shocks and commodity market dynamics: New evidence from the Russia-Ukraine conflict,European Journal of Political Economy,10.1016/j.ejpoleco.2024.102574,85,,,2024-12-01,"[{'@_fa': 'true', 'affilname': 'University of Southern California', 'affiliation-city': 'Los Angeles', 'affiliation-country': 'United States'}]",-0.1234553128007165,University of Southern California,United States,2024,12
ECON,Gu J.,Carbon emissions cap or energy technology subsidies? Exploring the carbon reduction policy based on a multi-technology sectoral DSGE model,Humanities and Social Sciences Communications,10.1057/s41599-024-03320-x,11,1,,2024-12-01,"[{'@_fa': 'true', 'affilname': 'Chongqing University', 'affiliation-city': 'Chongqing', 'affiliation-country': 'China'}]",-0.1234553128007165,Chongqing University,China,2024,12
ECON,Chen E.,Perpetual future contracts in centralized and decentralized exchanges: Mechanism and traders’ behavior,Electronic Markets,10.1007/s12525-024-00715-1,34,1,,2024-12-01,"[{'@_fa': 'true', 'affilname': 'School of Computer Science and Engineering', 'affiliation-city': 'Singapore City', 'affiliation-country': 'Singapore'}]",-0.1234553128007165,School of Computer Science and Engineering,Singapore,2024,12
ECON,Hu J.,The influence of age at first regular digital device access on digital reading performance: the mediating effect of cognitive flexibility,Humanities and Social Sciences Communications,10.1057/s41599-024-03292-y,11,1,,2024-12-01,"[{'@_fa': 'true', 'affilname': 'School of International Studies, Zhejiang University', 'affiliation-city': 'Hangzhou', 'affiliation-country': 'China'}]",-0.1234553128007165,"School of International Studies, Zhejiang University",China,2024,12
ECON,Wei Y.,How to improve tourists’ trust in official tourism destination websites in China—an empirical research based on CV and PASP,Humanities and Social Sciences Communications,10.1057/s41599-024-03263-3,11,1,,2024-12-01,"[{'@_fa': 'true', 'affilname': 'Zhongyuan University of Technology', 'affiliation-city': 'Zhengzhou', 'affiliation-country': 'China'}]",-0.1234553128007165,Zhongyuan University of Technology,China,2024,12
ECON,Cui X.,Exploring the spatiotemporal evolution mechanism of rural e-commerce: insights from the experience of Taobao towns in China,Humanities and Social Sciences Communications,10.1057/s41599-024-03306-9,11,1,,2024-12-01,"[{'@_fa': 'true', 'affilname': 'Zhongnan University of Economics and Law', 'affiliation-city': 'Wuhan', 'affiliation-country': 'China'}]",-0.1234553128007165,Zhongnan University of Economics and Law,China,2024,12
ECON,Huang Z.,Fostering students’ geographical synthetic thinking using geographic subject mind maps,Humanities and Social Sciences Communications,10.1057/s41599-024-03312-x,11,1,,2024-12-01,"[{'@_fa': 'true', 'affilname': 'East China Normal University', 'affiliation-city': 'Shanghai', 'affiliation-country': 'China'}]",-0.1234553128007165,East China Normal University,China,2024,12
ECON,Al-Hattami H.M.,What factors influence the intention to adopt blockchain technology in accounting education?,Humanities and Social Sciences Communications,10.1057/s41599-024-03315-8,11,1,,2024-12-01,"[{'@_fa': 'true', 'affilname': 'A’Sharqiyah University', 'affiliation-city': 'Ibra', 'affiliation-country': 'Oman'}, {'@_fa': 'true', 'affilname': 'Hodeida University', 'affiliation-city': 'Al Hudaydah', 'affiliation-country': 'Yemen'}]",-0.1234553128007165,A’Sharqiyah University,Oman,2024,12
ECON,Liu Q.,Data selection and collection for constructing investor sentiment from social media,Humanities and Social Sciences Communications,10.1057/s41599-024-03316-7,11,1,,2024-12-01,"[{'@_fa': 'true', 'affilname': 'Huainan Normal University', 'affiliation-city': 'Huainan', 'affiliation-country': 'China'}, {'@_fa': 'true', 'affilname': 'Pukyong National University', 'affiliation-city': 'Busan', 'affiliation-country': 'South Korea'}]",-0.1234553128007165,Huainan Normal University,China,2024,12
ECON,Liu T.L.,Analysing the impact of digital technology diffusion on the efficiency and convergence process of the commercial banking industry of Pakistan,Humanities and Social Sciences Communications,10.1057/s41599-024-03184-1,11,1,,2024-12-01,"[{'@_fa': 'true', 'affilname': 'Beijing University of Technology', 'affiliation-city': 'Beijing', 'affiliation-country': 'China'}]",-0.1234553128007165,Beijing University of Technology,China,2024,12
ECON,Wu Z.,Temporal and spatial effects of manufacturing agglomeration on CO<inf>2</inf> emissions: evidence from South Korea,Humanities and Social Sciences Communications,10.1057/s41599-024-03287-9,11,1,,2024-12-01,"[{'@_fa': 'true', 'affilname': 'Honam University', 'affiliation-city': 'Gwangju', 'affiliation-country': 'South Korea'}]",-0.1234553128007165,Honam University,South Korea,2024,12
ECON,Gao R.,Understanding the use of metaphors by parents of children with cancer in blogs: a qualitative analysis,Humanities and Social Sciences Communications,10.1057/s41599-024-03284-y,11,1,,2024-12-01,"[{'@_fa': 'true', 'affilname': 'Qufu Normal University', 'affiliation-city': 'Qufu', 'affiliation-country': 'China'}]",-0.1234553128007165,Qufu Normal University,China,2024,12
ECON,Kurt H.I.,"Erratum to “Chemotaxis systems with singular sensitivity and logistic source: Boundedness, persistence, absorbing set, and entire solutions” [Nonlinear Anal. Real World Appl. 69 (2023) 27] (Nonlinear Analysis: Real World Applications (2023) 69, (S1468121822001456), (10.1016/j.nonrwa.2022.103762))",Nonlinear Analysis: Real World Applications,10.1016/j.nonrwa.2024.104141,80,,,2024-12-01,"[{'@_fa': 'true', 'affilname': 'Auburn University', 'affiliation-city': 'Auburn', 'affiliation-country': 'United States'}]",-0.1234553128007165,Auburn University,United States,2024,12
ECON,Das P.,The role of community mobilization in people’s healthcare-seeking behavior during the COVID-19 vaccination journey: select case studies from Madhya Pradesh,Humanities and Social Sciences Communications,10.1057/s41599-024-03275-z,11,1,,2024-12-01,"[{'@_fa': 'true', 'affilname': 'Government of Madhya Pradesh', 'affiliation-city': 'Bhopal', 'affiliation-country': 'India'}]",-0.1234553128007165,Government of Madhya Pradesh,India,2024,12
ECON,Dosoftei C.C.,Students’ perception of peer teaching in engineering education: a mixed–method case study,Humanities and Social Sciences Communications,10.1057/s41599-024-03349-y,11,1,,2024-12-01,"[{'@_fa': 'true', 'affilname': 'Universitatea Tehnica Gh. Asachi din IasI', 'affiliation-city': 'Iasi', 'affiliation-country': 'Romania'}]",-0.1234553128007165,Universitatea Tehnica Gh. Asachi din IasI,Romania,2024,12
ECON,Arya P.J.,Learning to think: Deterritorialization in Mona Lisa Smile and Dead Poets Society,Humanities and Social Sciences Communications,10.1057/s41599-024-03338-1,11,1,,2024-12-01,"[{'@_fa': 'true', 'affilname': 'Vellore Institute of Technology, Chennai', 'affiliation-city': 'Chennai', 'affiliation-country': 'India'}]",-0.1234553128007165,"Vellore Institute of Technology, Chennai",India,2024,12
ECON,Ali I.,"An autoethnography of a transformative odyssey: decolonizing anthropology, the hegemony of English, and the pursuit of plurilogies",Humanities and Social Sciences Communications,10.1057/s41599-024-03218-8,11,1,,2024-12-01,"[{'@_fa': 'true', 'affilname': 'Fatima Jinnah Women University', 'affiliation-city': 'Rawalpindi', 'affiliation-country': 'Pakistan'}, {'@_fa': 'true', 'affilname': 'Universität Wien', 'affiliation-city': 'Vienna', 'affiliation-country': 'Austria'}]",-0.1234553128007165,Fatima Jinnah Women University,Pakistan,2024,12
ECON,Bonincontro T.,From unseen to seen in post-mining polluted territories: (in)visibilisation processes at work in soil contamination management,Humanities and Social Sciences Communications,10.1057/s41599-024-03290-0,11,1,,2024-12-01,"[{'@_fa': 'true', 'affilname': 'Université de Montpellier', 'affiliation-city': 'Montpellier', 'affiliation-country': 'France'}, {'@_fa': 'true', 'affilname': 'IMT Mines Alès', 'affiliation-city': 'Ales', 'affiliation-country': 'France'}]",-0.1234553128007165,Université de Montpellier,France,2024,12
ECON,Ţilică E.V.,Portfolio management under capital market frictions: a grey clustering approach,Financial Innovation,10.1186/s40854-024-00634-2,10,1,,2024-12-01,"[{'@_fa': 'true', 'affilname': 'Bucharest University of Economic Studies', 'affiliation-city': 'Bucharest', 'affiliation-country': 'Romania'}]",-0.1234553128007165,Bucharest University of Economic Studies,Romania,2024,12
ECON,Yu K.,The influence of robot applications on rural labor transfer,Humanities and Social Sciences Communications,10.1057/s41599-024-03333-6,11,1,,2024-12-01,"[{'@_fa': 'true', 'affilname': 'Southwestern University of Finance and Economics', 'affiliation-city': 'Chengdu', 'affiliation-country': 'China'}]",-0.1234553128007165,Southwestern University of Finance and Economics,China,2024,12
ECON,Jiang H.D.,Incentive policies to realize large-scale deployment of CCS in China's power sector and its economy-wide impacts,Structural Change and Economic Dynamics,10.1016/j.strueco.2024.06.002,71,,1-14,2024-12-01,"[{'@_fa': 'true', 'affilname': 'School of Economics and Management', 'affiliation-city': 'Beijing', 'affiliation-country': 'China'}, {'@_fa': 'true', 'affilname': 'Beijing Institute of Technology', 'affiliation-city': 'Beijing', 'affiliation-country': 'China'}]",-0.1234553128007165,School of Economics and Management,China,2024,12
ECON,He H.,Boundedness of weak solutions to a 3D chemotaxis-Stokes system with slow p−Laplacian diffusion and rotation,Nonlinear Analysis: Real World Applications,10.1016/j.nonrwa.2024.104164,80,,,2024-12-01,"[{'@_fa': 'true', 'affilname': 'China West Normal University', 'affiliation-city': 'Nanchong', 'affiliation-country': 'China'}]",0.9988657126603426,China West Normal University,China,2024,12
ECON,Xie H.,Home‑rearing environment and preschoolers’ academic and behavioral competence: The indirect role of children’s screen time,Humanities and Social Sciences Communications,10.1057/s41599-024-03326-5,11,1,,2024-12-01,"[{'@_fa': 'true', 'affilname': 'Universiti Sains Malaysia', 'affiliation-city': 'Minden', 'affiliation-country': 'Malaysia'}, {'@_fa': 'true', 'affilname': 'North Sichuan College of Preschool Teacher Education', 'affiliation-city': 'Sichuan', 'affiliation-country': 'China'}]",-0.1234553128007165,Universiti Sains Malaysia,Malaysia,2024,12
ECON,Jian B.,The effect of cadre–farmer relationship on farmers’ willingness to treat domestic waste: evidence from China,Humanities and Social Sciences Communications,10.1057/s41599-024-03264-2,11,1,,2024-12-01,"[{'@_fa': 'true', 'affilname': 'Northwest A&amp;F University', 'affiliation-city': 'Yangling', 'affiliation-country': 'China'}]",-0.1234553128007165,Northwest A&amp;F University,China,2024,12
ECON,Zhou Y.,The reduction of Netspeak in Mandarin computer-mediated communication: a least effort motivation at the utterance level,Humanities and Social Sciences Communications,10.1057/s41599-024-03319-4,11,1,,2024-12-01,"[{'@_fa': 'true', 'affilname': 'Yangzhou University', 'affiliation-city': 'Yangzhou', 'affiliation-country': 'China'}]",-0.1234553128007165,Yangzhou University,China,2024,12
ECON,Lin Z.,Can digital transformation curtail carbon emissions? Evidence from a quasi-natural experiment,Humanities and Social Sciences Communications,10.1057/s41599-024-03334-5,11,1,,2024-12-01,"[{'@_fa': 'true', 'affilname': 'Sun Yat-Sen University', 'affiliation-city': 'Guangzhou', 'affiliation-country': 'China'}]",-0.1234553128007165,Sun Yat-Sen University,China,2024,12
ECON,Bernardi F.,Cultivating inclusivity in introductory undergraduate STEM course syllabi,Humanities and Social Sciences Communications,10.1057/s41599-024-03276-y,11,1,,2024-12-01,"[{'@_fa': 'true', 'affilname': 'Worcester Polytechnic Institute', 'affiliation-city': 'Worcester', 'affiliation-country': 'United States'}]",-0.1234553128007165,Worcester Polytechnic Institute,United States,2024,12
ECON,Dai R.,The implication of the illness metaphors of In America: Mitigating negative effects of metaphors through illness narratives in the postpandemic era of COVID-19,Humanities and Social Sciences Communications,10.1057/s41599-024-03308-7,11,1,,2024-12-01,"[{'@_fa': 'true', 'affilname': 'Southwest University', 'affiliation-city': 'Chongqing', 'affiliation-country': 'China'}]",-0.1234553128007165,Southwest University,China,2024,12
ECON,Bruna F.,"Correction to: Market potential: the measurement of domestic market size (Letters in Spatial and Resource Sciences, (2024), 17, 1, (13), 10.1007/s12076-024-00378-8)",Letters in Spatial and Resource Sciences,10.1007/s12076-024-00381-z,17,1,,2024-12-01,"[{'@_fa': 'true', 'affilname': 'Universidade da Coruña', 'affiliation-city': 'La Coruna', 'affiliation-country': 'Spain'}]",-0.1234553128007165,Universidade da Coruña,Spain,2024,12
ECON,Ambrosj J.,Codes of conduct should help scientists navigate societal expectations,Humanities and Social Sciences Communications,10.1057/s41599-024-03261-5,11,1,,2024-12-01,"[{'@_fa': 'true', 'affilname': 'KU Leuven', 'affiliation-city': 'Leuven', 'affiliation-country': 'Belgium'}]",-0.1234553128007165,KU Leuven,Belgium,2024,12
ECON,Qiao R.,Making algorithmic app use a virtuous cycle: Influence of user gratification and fatigue on algorithmic app dependence,Humanities and Social Sciences Communications,10.1057/s41599-024-03221-z,11,1,,2024-12-01,"[{'@_fa': 'true', 'affilname': 'Shanghai University of Finance and Economics', 'affiliation-city': 'Shanghai', 'affiliation-country': 'China'}]",-0.1234553128007165,Shanghai University of Finance and Economics,China,2024,12
ECON,Kashif U.,Navigating the digital divide: unraveling the impact of ICT usage and supply on SO<inf>2</inf> emissions in China’s Yangtze River Delta,Humanities and Social Sciences Communications,10.1057/s41599-024-03311-y,11,1,,2024-12-01,"[{'@_fa': 'true', 'affilname': 'Jiangsu University', 'affiliation-city': 'Zhenjiang', 'affiliation-country': 'China'}]",-0.1234553128007165,Jiangsu University,China,2024,12
ECON,Escobar E.D.,Optimal Power and Battery Storage Dispatch Architecture for Microgrids: Implementation in a Campus Microgrid,Smart Grids and Sustainable Energy,10.1007/s40866-024-00210-8,9,2,,2024-12-01,"[{'@_fa': 'true', 'affilname': 'Universidad Pontificia Bolivariana', 'affiliation-city': 'Medellin', 'affiliation-country': 'Colombia'}]",-0.1234553128007165,Universidad Pontificia Bolivariana,Colombia,2024,12
ECON,Yuan H.,Navigating the uncertainty: the impact of a student-centered final year project allocation mechanism on student performance,Humanities and Social Sciences Communications,10.1057/s41599-024-03324-7,11,1,,2024-12-01,"[{'@_fa': 'true', 'affilname': ""Xi'an Jiaotong-Liverpool University"", 'affiliation-city': 'Suzhou', 'affiliation-country': 'China'}]",-0.1234553128007165,,China,2024,12
ECON,Yang L.,Anti-corruption campaign in China: An empirical investigation,European Journal of Political Economy,10.1016/j.ejpoleco.2024.102559,85,,,2024-12-01,"[{'@_fa': 'true', 'affilname': 'Ecole d’Économie de Paris', 'affiliation-city': 'Paris', 'affiliation-country': 'France'}, {'@_fa': 'true', 'affilname': 'Zentrum für Europäische Wirtschaftsforschung GmbH', 'affiliation-city': 'Mannheim', 'affiliation-country': 'Germany'}]",-0.1234553128007165,Ecole d’Économie de Paris,France,2024,12
ECON,Liu Y.,Measurement of health human capital and its economic effect in China,Humanities and Social Sciences Communications,10.1057/s41599-024-03060-y,11,1,,2024-12-01,"[{'@_fa': 'true', 'affilname': 'Xuzhou University of Technology', 'affiliation-city': 'Xuzhou', 'affiliation-country': 'China'}]",-0.1234553128007165,Xuzhou University of Technology,China,2024,12
ECON,Roca Florido A.,Analysing the impacts of a reform on harmful fishery subsidies in Spain using a social accounting matrix,Journal of Economic Structures,10.1186/s40008-024-00329-y,13,1,,2024-12-01,"[{'@_fa': 'true', 'affilname': 'University of York', 'affiliation-city': 'York', 'affiliation-country': 'United Kingdom'}]",-0.1234553128007165,University of York,United Kingdom,2024,12
ECON,Okunlola O.C.,Effect of government expenditure on real economic growth in ECOWAS: assessing the moderating role of corruption and conflict,Humanities and Social Sciences Communications,10.1057/s41599-024-03285-x,11,1,,2024-12-01,"[{'@_fa': 'true', 'affilname': 'Derby Business School', 'affiliation-city': 'Derby', 'affiliation-country': 'United Kingdom'}]",-0.1234553128007165,Derby Business School,United Kingdom,2024,12
