topic,authors,title,publicationName,doi,volume,issue,pageRange,coverDate,affiliation,citedbyCount,affilname,affiliation-country,year,month
MEDI,Rollin J.,Physiotherapists andsocialmobilityattempts: thecaseofsportspecialisation,Staps,10.3917/sta.pr1.0084,Pub. anticipées,,,2025-01-12,"[{'@_fa': 'true', 'affilname': 'École Normale Supérieure de Lyon', 'affiliation-city': 'Lyon', 'affiliation-country': 'France'}]",-0.1234553128007165,École Normale Supérieure de Lyon,France,2025,1
MEDI,Dumas C.,"Performances, recordsandalternativeOlympisms duringtheinterwar period",Staps,10.3917/sta.pr1.0085,Pub. anticipées,,85-103,2025-01-12,"[{'@_fa': 'true', 'affilname': 'Centre d’Histoire ""Espaces et Cultures""', 'affiliation-city': 'Clermont-Ferrand', 'affiliation-country': 'France'}]",-0.1234553128007165,"Centre d’Histoire ""Espaces et Cultures""",France,2025,1
MEDI,Auvray E.,The place of women in the toponymy of French public swimming pools (1969-2021),Staps,10.3917/sta.pr1.0077,Pub. anticipées,,177-198,2025-01-12,"[{'@_fa': 'true', 'affilname': 'Université de Caen Normandie', 'affiliation-city': 'Caen', 'affiliation-country': 'France'}]",-0.1234553128007165,Université de Caen Normandie,France,2025,1
MEDI,Rougnant T.,"Sébastien Fleuriel, Jean-François Goubet, Stéphan Mierzejewski, Manuel Schotté (dir.), Ce qu’incorporer veut dire <inf>coll.</inf><inf>«</inf> Villeneuve-d’Ascq, <inf>Épistémologie des</inf> Presses <inf>sciences</inf> universitaires <inf>sociales», 2021,</inf> du Septentrion, <inf>284 p.</inf>",Staps,10.3917/sta.pr1.0087,Pub. anticipées,,,2025-01-12,"[{'@_fa': 'true', 'affilname': 'Centre Maurice Halbwachs', 'affiliation-city': 'Paris', 'affiliation-country': 'France'}]",-0.1234553128007165,Centre Maurice Halbwachs,France,2025,1
MEDI,Gauthier J.A.,Assessment of situations of abuse by young athletes. An innovative approach associated with the 2020 Youth Olympic Games,Staps,10.3917/sta.pr1.0072,Pub. anticipées,,172-194,2025-01-12,"[{'@_fa': 'true', 'affilname': 'Université de Lausanne (UNIL)', 'affiliation-city': 'Lausanne', 'affiliation-country': 'Switzerland'}]",0.9988657126603426,Université de Lausanne (UNIL),Switzerland,2025,1
MEDI,de Albuquerque Cavalcanti E.,Memories of Brazilian soccer players: between the profession of athlete and life outside of sport,Staps,10.3917/sta.pr1.0076,Pub. anticipées,,176-191,2025-01-12,"[{'@_fa': 'true', 'affilname': 'Universidade Federal de Mato Grosso do Sul', 'affiliation-city': 'Campo Grande', 'affiliation-country': 'Brazil'}]",-0.1234553128007165,Universidade Federal de Mato Grosso do Sul,Brazil,2025,1
MEDI,Bourbillères H.,Les événements sportifs récurrents à Paris face aux injonctions de mixité sociale,Staps,10.3917/sta.pr1.0089,Pub. anticipées,,,2025-01-12,"[{'@_fa': 'true', 'affilname': 'Université Rennes 2', 'affiliation-city': 'Rennes', 'affiliation-country': 'France'}]",-0.1234553128007165,Université Rennes 2,France,2025,1
MEDI,Chanavat N.,The Olympic brand: Between historical foundations and innovations. Milestones for a research agenda on brand management based on the past,Staps,10.3917/sta.pr1.0079,Pub. anticipées,,179-197,2025-01-12,"[{'@_fa': 'true', 'affilname': ""CETAPS - Centre d'Etudes des Transformations des Activités Physiques et Sportives"", 'affiliation-city': 'Mont-Saint-Aignan', 'affiliation-country': 'France'}, {'@_fa': 'true', 'affilname': 'Académie Nationale Olympique Française', 'affiliation-city': 'Paris', 'affiliation-country': 'France'}]",0.9988657126603426,Académie Nationale Olympique Française,France,2025,1
MEDI,Caumeil B.,"Determinants and definitions of re-injury anxiety, fear of re-injury and kinesiophobia: a systematic review",Staps,10.3917/sta.pr1.0094,Pub. anticipées,,194-217,2025-01-12,"[{'@_fa': 'true', 'affilname': 'Aix Marseille Université', 'affiliation-city': 'Marseille', 'affiliation-country': 'France'}]",-0.1234553128007165,Aix Marseille Université,France,2025,1
MEDI,Hermand É.,Bone conduction: A technology to help the progress of speed swimmers?,Staps,10.3917/sta.pr1.0098,Pub. anticipées,,198-210,2025-01-12,"[{'@_fa': 'true', 'affilname': 'Hypoxie &amp; Poumon (H&amp;P)', 'affiliation-city': 'Bobigny', 'affiliation-country': 'France'}, {'@_fa': 'true', 'affilname': 'Unité de Recherche Pluridisciplinaire Sport, Santé, Société (URePSSS)', 'affiliation-city': 'Dunkerque', 'affiliation-country': 'France'}]",-0.1234553128007165,Hypoxie &amp; Poumon (H&amp;P),France,2025,1
MEDI,Tajri Y.,"Serge Durali, Guillaume Dietsch, Une histoire politique de l'EPS. Du XIX<sup>e</sup> siècle à nos jours, Louvain-la-Neuve, De Boeck Supérieur, 2022, 359 p.",Staps,10.3917/sta.pr1.0071,Pub. anticipées,,171-173,2025-01-12,"[{'@_fa': 'true', 'affilname': 'Université Gustave Eiffel', 'affiliation-city': 'Marne-la-Vallee', 'affiliation-country': 'France'}]",-0.1234553128007165,Université Gustave Eiffel,France,2025,1
MEDI,Durand P.,"Fragment of a retrospective, strategic and cultural analysis of a failure in the sporting goods industry: The failed takeover of Rossignol by Quiksilver",Staps,10.3917/sta.pr1.0096,Pub. anticipées,,196-207,2025-01-12,"[{'@_fa': 'true', 'affilname': 'Laboratoire Cultures Éducation Sociétés', 'affiliation-city': 'Bordeaux', 'affiliation-country': 'France'}]",0.9988657126603426,Laboratoire Cultures Éducation Sociétés,France,2025,1
MEDI,Grün L.,"Thierry Terret, Balades olympiques, vol. 5, Les chemins éducatifs, Paris, L’Harmattan, coll. « Espaces et temps du sport», 2023, 186 p.",Staps,10.3917/sta.pr1.0088,Pub. anticipées,,,2025-01-12,"[{'@_fa': 'true', 'affilname': 'Centre Régional Universitaire Lorrain d’Histoire (CRULH', 'affiliation-city': None, 'affiliation-country': 'France'}]",-0.1234553128007165,Centre Régional Universitaire Lorrain d’Histoire (CRULH,France,2025,1
MEDI,Plard M.,Trail-Running and Ultramarathon: A Multidisciplinary Scoping Review,Staps,10.3917/sta.pr1.0092,Pub. anticipées,,192-209,2025-01-12,"[{'@_fa': 'true', 'affilname': 'Université d’Angers', 'affiliation-city': 'Angers', 'affiliation-country': 'France'}]",-0.1234553128007165,Université d’Angers,France,2025,1
MEDI,Forté L.,"From 'being a pro' to becoming a professional: Variability of discourse, practices and resources within the French athletic elite",Staps,10.3917/sta.pr1.0093,Pub. anticipées,,193-214,2025-01-12,"[{'@_fa': 'true', 'affilname': 'CreSco EA', 'affiliation-city': None, 'affiliation-country': 'France'}]",-0.1234553128007165,CreSco EA,France,2025,1
MEDI,Pochon S.,"Bastien Pouy-Bidard, Transidentités enÉducationPhysique etSportive (EPS), Paris, L’Harmattan, coll. « Prix scientifique», 2022, 160 p. Préface d’Anne Barrère et Dominique Bret.",Staps,10.3917/sta.pr1.0083,Pub. anticipées,,,2025-01-12,"[{'@_fa': 'true', 'affilname': ""Universite d'Artois"", 'affiliation-city': 'Arras', 'affiliation-country': 'France'}]",-0.1234553128007165,,France,2025,1
MEDI,Del Ciampo L.A.,Iron deficiency and changes in sleep: two conditions that compromise child growth and development,Revista Paulista de Pediatria,10.1590/1984-0462/2025/43/2024017,43,,,2025-01-01,"[{'@_fa': 'true', 'affilname': 'Universidade de São Paulo', 'affiliation-city': 'Sao Paulo', 'affiliation-country': 'Brazil'}]",-0.1234553128007165,Universidade de São Paulo,Brazil,2025,1
MEDI,Zhang H.,Expression analysis of lymphocyte subsets and lymphocyte-to-monocyte ratio: reveling immunosuppression and chronic inflammation in breast cancer,Journal of Cancer Research and Clinical Oncology,10.1007/s00432-023-05508-1,150,1,,2025-01-01,"[{'@_fa': 'true', 'affilname': 'The First Affiliated Hospital of Chongqing Medical University', 'affiliation-city': 'Chongqing', 'affiliation-country': 'China'}]",-0.1234553128007165,The First Affiliated Hospital of Chongqing Medical University,China,2025,1
MEDI,He S.,Human papillomavirus E7 protein induces homologous recombination defects and PARPi sensitivity,Journal of Cancer Research and Clinical Oncology,10.1007/s00432-023-05511-6,150,1,,2025-01-01,"[{'@_fa': 'true', 'affilname': 'West China Second University Hospital', 'affiliation-city': 'Chengdu', 'affiliation-country': 'China'}]",0.9988657126603426,West China Second University Hospital,China,2025,1
MEDI,Lu J.,Prognostic value of preoperative circulating tumor DNA in non-small cell lung cancer: a systematic review and meta-analysis,Journal of Cancer Research and Clinical Oncology,10.1007/s00432-023-05550-z,150,1,,2025-01-01,"[{'@_fa': 'true', 'affilname': 'Zhejiang Chinese Medical University', 'affiliation-city': 'Hangzhou', 'affiliation-country': 'China'}, {'@_fa': 'true', 'affilname': 'China Medical University Shenyang', 'affiliation-city': 'Shenyang', 'affiliation-country': 'China'}]",-0.1234553128007165,Zhejiang Chinese Medical University,China,2025,1
MEDI,Liu R.,The poor prognosis of lacrimal gland adenocarcinoma: a clinical study and literature review,Journal of Cancer Research and Clinical Oncology,10.1007/s00432-023-05510-7,150,1,,2025-01-01,"[{'@_fa': 'true', 'affilname': 'Beijing Tongren Hospital, Capital Medical University', 'affiliation-city': 'Beijing', 'affiliation-country': 'China'}]",-0.1234553128007165,"Beijing Tongren Hospital, Capital Medical University",China,2025,1
MEDI,Maddah Safaei A.,Hypofractionated versus standard chemoradiotherapy in the definitive treatment of uterine cervix cancer: interim results of a randomized controlled clinical trial,Journal of Cancer Research and Clinical Oncology,10.1007/s00432-023-05563-8,150,1,,2025-01-01,"[{'@_fa': 'true', 'affilname': 'Cancer Research Institute', 'affiliation-city': 'Tehran', 'affiliation-country': 'Iran'}]",-0.1234553128007165,Cancer Research Institute,Iran,2025,1
MEDI,Wang Q.,Mitophagy plays a “double-edged sword” role in the radiosensitivity of cancer cells,Journal of Cancer Research and Clinical Oncology,10.1007/s00432-023-05515-2,150,1,,2025-01-01,"[{'@_fa': 'true', 'affilname': 'Lanzhou University', 'affiliation-city': 'Lanzhou', 'affiliation-country': 'China'}]",0.9988657126603426,Lanzhou University,China,2025,1
MEDI,Fang F.,Ultrasound-based deep learning radiomics nomogram for risk stratification of testicular masses: a two-center study,Journal of Cancer Research and Clinical Oncology,10.1007/s00432-023-05549-6,150,1,,2025-01-01,"[{'@_fa': 'true', 'affilname': 'The First Affiliated Hospital of Guangxi Medical University', 'affiliation-city': 'Nanning', 'affiliation-country': 'China'}]",0.9988657126603426,The First Affiliated Hospital of Guangxi Medical University,China,2025,1
MEDI,Xu T.,Derivation and validation of a nomogram based on clinical characteristics to diagnose endometriosis associated ovarian cancer preoperatively,Journal of Cancer Research and Clinical Oncology,10.1007/s00432-023-05524-1,150,1,,2025-01-01,"[{'@_fa': 'true', 'affilname': 'Jiangsu Province Hospital', 'affiliation-city': 'Nanjing', 'affiliation-country': 'China'}]",-0.1234553128007165,Jiangsu Province Hospital,China,2025,1
MEDI,Meng X.,FSTL3 is associated with prognosis and immune cell infiltration in lung adenocarcinoma,Journal of Cancer Research and Clinical Oncology,10.1007/s00432-023-05553-w,150,1,,2025-01-01,"[{'@_fa': 'true', 'affilname': 'Chinese Academy of Medical Sciences &amp; Peking Union Medical College', 'affiliation-city': 'Beijing', 'affiliation-country': 'China'}]",-0.1234553128007165,Chinese Academy of Medical Sciences &amp; Peking Union Medical College,China,2025,1
MEDI,Pu D.,Efficacy of CDK4/6 inhibitors combined with endocrine therapy in HR+/HER2− breast cancer: an umbrella review,Journal of Cancer Research and Clinical Oncology,10.1007/s00432-023-05516-1,150,1,,2025-01-01,"[{'@_fa': 'true', 'affilname': 'Shandong University of Traditional Chinese Medicine', 'affiliation-city': 'Jinan', 'affiliation-country': 'China'}]",-0.1234553128007165,Shandong University of Traditional Chinese Medicine,China,2025,1
MEDI,Wang J.,Efficacy and safety of first-line therapy in patients with HER2-positive advanced breast cancer: a network meta-analysis of randomized controlled trials,Journal of Cancer Research and Clinical Oncology,10.1007/s00432-023-05530-3,150,1,,2025-01-01,"[{'@_fa': 'true', 'affilname': 'Fujian Medical University', 'affiliation-city': 'Fuzhou', 'affiliation-country': 'China'}, {'@_fa': 'true', 'affilname': 'Second Hospital of Sanming City', 'affiliation-city': 'Sanming', 'affiliation-country': 'China'}]",2.1211867381214016,Fujian Medical University,China,2025,1
MEDI,Reitmajer M.,Long-term survival of stage IV melanoma patients: evaluation on 640 melanoma patients entering stage IV between 2014 and 2017,Journal of Cancer Research and Clinical Oncology,10.1007/s00432-023-05533-0,150,1,,2025-01-01,"[{'@_fa': 'true', 'affilname': 'Universitätsklinikum und Medizinische Fakultät Tübingen', 'affiliation-city': 'Tubingen', 'affiliation-country': 'Germany'}]",0.9988657126603426,Universitätsklinikum und Medizinische Fakultät Tübingen,Germany,2025,1
MEDI,Zhu L.,Predictive biomarkers for immunotherapy response in extensive-stage SCLC,Journal of Cancer Research and Clinical Oncology,10.1007/s00432-023-05544-x,150,1,,2025-01-01,"[{'@_fa': 'true', 'affilname': 'Chinese Academy of Sciences', 'affiliation-city': 'Beijing', 'affiliation-country': 'China'}]",-0.1234553128007165,Chinese Academy of Sciences,China,2025,1
MEDI,Wang J.,Immunogenic profiling of metastatic uveal melanoma discerns a potential signature related to prognosis,Journal of Cancer Research and Clinical Oncology,10.1007/s00432-023-05542-z,150,1,,2025-01-01,"[{'@_fa': 'true', 'affilname': 'Tangdu Hospital, Fourth Military Medical University', 'affiliation-city': ""Xi'an"", 'affiliation-country': 'China'}]",-0.1234553128007165,"Tangdu Hospital, Fourth Military Medical University",China,2025,1
MEDI,Qiu G.,Incidence of second malignancies in patients with thymic carcinoma and thymic neuroendocrine tumor,Journal of Cancer Research and Clinical Oncology,10.1007/s00432-023-05522-3,150,1,,2025-01-01,"[{'@_fa': 'true', 'affilname': 'West China School of Medicine/West China Hospital of Sichuan University', 'affiliation-city': 'Chengdu', 'affiliation-country': 'China'}]",0.9988657126603426,West China School of Medicine/West China Hospital of Sichuan University,China,2025,1
MEDI,Wang Z.,An update of predictive biomarkers related to WEE1 inhibition in cancer therapy,Journal of Cancer Research and Clinical Oncology,10.1007/s00432-023-05527-y,150,1,,2025-01-01,"[{'@_fa': 'true', 'affilname': 'Tongji Medical College of Huazhong University of Science and Technology', 'affiliation-city': 'Wuhan', 'affiliation-country': 'China'}]",-0.1234553128007165,Tongji Medical College of Huazhong University of Science and Technology,China,2025,1
MEDI,Lei J.,Vemurafenib combined with chemotherapy achieved sustained remission in pediatric LCH: a multi-center observational study,Journal of Cancer Research and Clinical Oncology,10.1007/s00432-023-05551-y,150,1,,2025-01-01,"[{'@_fa': 'true', 'affilname': 'Sun Yat-Sen University', 'affiliation-city': 'Guangzhou', 'affiliation-country': 'China'}]",-0.1234553128007165,Sun Yat-Sen University,China,2025,1
MEDI,Malinowski J.,Value of high-speed videoendoscopy as an auxiliary tool in differentiation of benign and malignant unilateral vocal lesions,Journal of Cancer Research and Clinical Oncology,10.1007/s00432-023-05543-y,150,1,,2025-01-01,"[{'@_fa': 'true', 'affilname': 'Medical University of Lodz', 'affiliation-city': 'Lodz', 'affiliation-country': 'Poland'}]",-0.1234553128007165,Medical University of Lodz,Poland,2025,1
MEDI,Johann L.,"Analysis of laboratory parameters before the occurrence of hepatic sinusoidal obstruction syndrome in children, adolescents, and young adults after hematopoietic stem cell transplantation",Journal of Cancer Research and Clinical Oncology,10.1007/s00432-023-05561-w,150,1,,2025-01-01,"[{'@_fa': 'true', 'affilname': 'Universitätsklinikum Jena und Medizinische Fakultät', 'affiliation-city': 'Jena', 'affiliation-country': 'Germany'}, {'@_fa': 'true', 'affilname': 'Comprehensive Cancer Center Central Germany (CCCG)', 'affiliation-city': 'Jena', 'affiliation-country': 'Germany'}]",-0.1234553128007165,Universitätsklinikum Jena und Medizinische Fakultät,Germany,2025,1
MEDI,Xu J.,Plasma cell-free DNA as a sensitive biomarker for multi-cancer detection and immunotherapy outcomes prediction,Journal of Cancer Research and Clinical Oncology,10.1007/s00432-023-05521-4,150,1,,2025-01-01,"[{'@_fa': 'true', 'affilname': 'Jiangsu Cancer Hospital', 'affiliation-city': 'Nanjing', 'affiliation-country': 'China'}, {'@_fa': 'true', 'affilname': 'Nanjing Medical University', 'affiliation-city': 'Nanjing', 'affiliation-country': 'China'}]",-0.1234553128007165,Jiangsu Cancer Hospital,China,2025,1
MEDI,Huang X.D.,NUDT21 interacts with NDUFS2 to activate the PI3K/AKT pathway and promotes pancreatic cancer pathogenesis,Journal of Cancer Research and Clinical Oncology,10.1007/s00432-023-05540-1,150,1,,2025-01-01,"[{'@_fa': 'true', 'affilname': 'Xuanwu Hospital, Capital Medical University', 'affiliation-city': 'Beijing', 'affiliation-country': 'China'}]",0.9988657126603426,"Xuanwu Hospital, Capital Medical University",China,2025,1
MEDI,Shi A.,Natural products targeting the MAPK-signaling pathway in cancer: overview,Journal of Cancer Research and Clinical Oncology,10.1007/s00432-023-05572-7,150,1,,2025-01-01,"[{'@_fa': 'true', 'affilname': 'Changchun University of Chinese Medicine', 'affiliation-city': 'Changchun', 'affiliation-country': 'China'}]",-0.1234553128007165,Changchun University of Chinese Medicine,China,2025,1
MEDI,Huang G.,The efficacy of immune checkpoint inhibitors therapy versus chemotherapy in the treatment of advanced and metastatic urothelial carcinoma: a meta-analysis,Journal of Cancer Research and Clinical Oncology,10.1007/s00432-023-05584-3,150,1,,2025-01-01,"[{'@_fa': 'true', 'affilname': 'Guangdong Medical University', 'affiliation-city': 'Zhanjiang', 'affiliation-country': 'China'}]",0.9988657126603426,Guangdong Medical University,China,2025,1
MEDI,Shi X.,A semi-supervised ensemble clustering algorithm for discovering relationships between different diseases by extracting cell-to-cell biological communications,Journal of Cancer Research and Clinical Oncology,10.1007/s00432-023-05559-4,150,1,,2025-01-01,"[{'@_fa': 'true', 'affilname': 'Weinan Normal University', 'affiliation-city': 'Weinan', 'affiliation-country': 'China'}]",-0.1234553128007165,Weinan Normal University,China,2025,1
MEDI,Lin W.,Gastroenteropancreatic neuroendocrine carcinoma in children and adolescents: a population-based study,Journal of Cancer Research and Clinical Oncology,10.1007/s00432-023-05568-3,150,1,,2025-01-01,"[{'@_fa': 'true', 'affilname': ""Xi'an International Medical Center Hospital"", 'affiliation-city': ""Xi'an"", 'affiliation-country': 'China'}]",-0.1234553128007165,,China,2025,1
MEDI,,Erratum: Correction (Cancer biology &amp; therapy (2018) 19 3 (188-197)),Cancer biology &amp; therapy,10.1080/15384047.2024.2352926,25,1,2352926,2024-12-31,,-0.1234553128007165,,,2024,12
MEDI,Muruganantham J.K.,Pregnancy Complications in Women with Uterine Fibroids and the Role of Stem Cells,Tanzania Journal of Health Research,10.4314/thrb.v25i1.4,25,1,543-554,2024-12-31,"[{'@_fa': 'true', 'affilname': 'Chettinad Academy of Research and Education', 'affiliation-city': 'Kelambakkam', 'affiliation-country': 'India'}]",-0.1234553128007165,Chettinad Academy of Research and Education,India,2024,12
MEDI,Mashoto K.O.,"Oral Hygiene Status and Experience of Orthodontic Appliance Breakage Among Adolescents and Young People Treated at Smiles Dental Clinic, Dar es Salaam, Tanzania",Tanzania Journal of Health Research,10.4314/thrb.v25i1.9,25,1,605-611,2024-12-31,"[{'@_fa': 'true', 'affilname': 'National Institute for Medical Research Tanga', 'affiliation-city': 'Tanga', 'affiliation-country': 'Tanzania'}]",-0.1234553128007165,National Institute for Medical Research Tanga,Tanzania,2024,12
MEDI,Ngowi A.F.,"Obstetric factors associated with the uptake of Postnatal Care among mothers who gave birth in the last six months in Dodoma Region, Tanzania",Tanzania Journal of Health Research,10.4314/thrb.v25i1.6,25,1,568-581,2024-12-31,"[{'@_fa': 'true', 'affilname': 'The University of Dodoma', 'affiliation-city': 'Dodoma', 'affiliation-country': 'Tanzania'}]",0.9988657126603426,The University of Dodoma,Tanzania,2024,12
MEDI,,Erratum: Correction (Cancer biology &amp; therapy (2024) 25 1 (2290732)),Cancer biology &amp; therapy,10.1080/15384047.2024.2318833,25,1,2318833,2024-12-31,,-0.1234553128007165,,,2024,12
MEDI,,Erratum: Correction (Human vaccines &amp; immunotherapeutics (2023) 19 3 (2277083)),Human vaccines &amp; immunotherapeutics,10.1080/21645515.2024.2307699,20,1,2307699,2024-12-31,,-0.1234553128007165,,,2024,12
MEDI,Ellis R.,Human vaccines and immunotherapeutics: News December 2023,Human vaccines &amp; immunotherapeutics,10.1080/21645515.2024.2305025,20,1,2305025,2024-12-31,,-0.1234553128007165,,,2024,12
MEDI,Son J.W.,The Last Rise and Fall Shown to us by the Man Who Chose “Swollen Foot”: The Film The Whale,Journal of the Korean Academy of Child and Adolescent Psychiatry,10.5765/jkacap.230074,35,1,98-100,2024-12-31,"[{'@_fa': 'true', 'affilname': 'Chungbuk National University, College of Medicine', 'affiliation-city': 'Cheongju', 'affiliation-country': 'South Korea'}]",-0.1234553128007165,"Chungbuk National University, College of Medicine",South Korea,2024,12
MEDI,,Erratum: Correction (Cancer biology &amp; therapy (2014) 15 6 (806-814)),Cancer biology &amp; therapy,10.1080/15384047.2024.2299054,25,1,2299054,2024-12-31,,-0.1234553128007165,,,2024,12
MEDI,Liu Z.,Tumor-derived exosomal miR-1247-3p promotes angiogenesis in bladder cancer by targeting FOXO1,Cancer biology &amp; therapy,10.1080/15384047.2023.2290033,25,1,2290033,2024-12-31,"[{'@_fa': 'true', 'affilname': 'China Three Gorges University', 'affiliation-city': 'Yichang', 'affiliation-country': 'China'}]",-0.1234553128007165,China Three Gorges University,China,2024,12
MEDI,Nath P.,The amino acid transporter SLC7A11 expression in breast cancer,Cancer biology &amp; therapy,10.1080/15384047.2023.2291855,25,1,2291855,2024-12-31,"[{'@_fa': 'true', 'affilname': 'University of Nottingham', 'affiliation-city': 'Nottingham', 'affiliation-country': 'United Kingdom'}]",0.9988657126603426,University of Nottingham,United Kingdom,2024,12
MEDI,Jiménez-Ruiz A.,Cerebral Venous Thrombosis Presenting as Simultaneous Intracerebral Hemorrhage,Acta neurologica Taiwanica,,33(4),,206-207,2024-12-30,"[{'@_fa': 'true', 'affilname': 'Hospital Civil de Guadalajara', 'affiliation-city': 'Guadalajara', 'affiliation-country': 'Mexico'}]",-0.1234553128007165,Hospital Civil de Guadalajara,Mexico,2024,12
MEDI,Lin C.J.,Tumefactive Demyelination Lesions: Report on three cases,Acta neurologica Taiwanica,,33(4),,195-200,2024-12-30,"[{'@_fa': 'true', 'affilname': 'Taipei Veterans General Hospital', 'affiliation-city': 'Taipei', 'affiliation-country': 'Taiwan'}]",-0.1234553128007165,Taipei Veterans General Hospital,Taiwan,2024,12
MEDI,Mousavi N.,Assessing the quantity of neuropeptide Y in the serum of patients referred to Baqiyatallah Hospital with covid-19 concerning inflammatory factors following steroid therapy,Acta neurologica Taiwanica,,33(4),,175-184,2024-12-30,"[{'@_fa': 'true', 'affilname': 'Baqiyatallah University of Medical Sciences', 'affiliation-city': 'Tehran', 'affiliation-country': 'Iran'}]",-0.1234553128007165,Baqiyatallah University of Medical Sciences,Iran,2024,12
MEDI,Lin Z.H.,Guillain-Barré Syndrome as a paraneoplastic neurological disease of pulmonary adenocarcinoma and squamous cell carcinoma: A case report,Acta neurologica Taiwanica,,33(4),,201-205,2024-12-30,"[{'@_fa': 'true', 'affilname': 'Veterans General Hospital-Kaohsiung Taiwan', 'affiliation-city': 'Kaohsiung', 'affiliation-country': 'Taiwan'}]",-0.1234553128007165,Veterans General Hospital-Kaohsiung Taiwan,Taiwan,2024,12
MEDI,Chu S.Y.,Taste Disorder and Tongue Numbness After Lithium Overdose,Acta neurologica Taiwanica,,33(4),,185-187,2024-12-30,"[{'@_fa': 'true', 'affilname': 'Chung Shan Medical University', 'affiliation-city': 'Taichung', 'affiliation-country': 'Taiwan'}]",-0.1234553128007165,Chung Shan Medical University,Taiwan,2024,12
MEDI,Verma A.,Clinical characteristics and risk factors for seizures to recur in calcified neurocysticercosis : Prospective cohort Study,Acta neurologica Taiwanica,,33(4),,153-160,2024-12-30,"[{'@_fa': 'true', 'affilname': 'All India Institute of Medical Sciences - Raebareli', 'affiliation-city': 'Raebareli', 'affiliation-country': 'India'}]",-0.1234553128007165,All India Institute of Medical Sciences - Raebareli,India,2024,12
MEDI,Huang H.K.,"Challenges in The Diagnosis of Ischemic stroke, Tuberculous Meningitis, and Co-Infection with HIV in a Socially Isolated Elderly Patient",Acta neurologica Taiwanica,,33(4),,188-194,2024-12-30,"[{'@_fa': 'true', 'affilname': 'Changhua Christian Hospital', 'affiliation-city': 'Changhua', 'affiliation-country': 'Taiwan'}]",-0.1234553128007165,Changhua Christian Hospital,Taiwan,2024,12
MEDI,Moosavimoghadam S.F.,The effect of 5A self-management program on medication adherence of epileptic patients during the COVID - 19 pandemic: A randomized controlled trial,Acta neurologica Taiwanica,,33(4),,165-174,2024-12-30,"[{'@_fa': 'true', 'affilname': 'Jahrom University of Medical Sciences', 'affiliation-city': 'Jahrom', 'affiliation-country': 'Iran'}]",-0.1234553128007165,Jahrom University of Medical Sciences,Iran,2024,12
MEDI,Algahtani H.A.,Perception of Neurologists on Intraoperative Neurophysiological Monitoring in Saudi Arabia,Acta neurologica Taiwanica,,33(4),,161-164,2024-12-30,"[{'@_fa': 'true', 'affilname': 'Assir Central Hospital', 'affiliation-city': 'Abha', 'affiliation-country': 'Saudi Arabia'}]",-0.1234553128007165,Assir Central Hospital,Saudi Arabia,2024,12
